{"schema_version":"ptk.recovery-manifest/1","guardian_boot_id":"11111111-1111-4111-8111-111111111111","host_generation":1,"catalog_digest":"c2d5c00a1d175536658b9ed55cb34dde2740423732f22f7e2ba664afe2d252b9","configuration_sha256":"cccccccccccccccccccccccccccccccccccccccccccccccccccccccccccccccc","templates":[],"bindings":[{"alias":"default","binding_kind":"default","template_name":null,"template_digest":null,"bootstrap_digest":null,"allow_cold_background":true,"desired_state":"ready","transition_version":0,"binding_digest":"dddddddddddddddddddddddddddddddddddddddddddddddddddddddddddddddd"}],"worker_generation_high_watermarks":[{"alias":"default","generation":0}],"host_generation_high_watermark":1}
